{
  "id": "grass",
  "label": "Feuilles et lianes",
  "baseId": "normal",
  "tracks": [
    {
      "id": "prepare",
      "trigger": "prepare",
      "kind": "particles",
      "assetId": "leaf",
      "color": "#a0dd83",
      "sizePixels": 5,
      "offset": {
        "x": 0,
        "y": 0
      },
      "delaySeconds": 0,
      "durationSeconds": 1.1,
      "count": 7,
      "speedTilesPerSecond": 0.4,
      "spreadDegrees": 360,
      "trailLengthTiles": 0.7,
      "layer": "overlay"
    },
    {
      "id": "release",
      "trigger": "activate",
      "kind": "particles",
      "assetId": "leaf",
      "color": "#a0dd83",
      "sizePixels": 10,
      "offset": {
        "x": 0,
        "y": 0
      },
      "delaySeconds": 0,
      "durationSeconds": 0.6,
      "count": 12,
      "speedTilesPerSecond": 1.6,
      "spreadDegrees": 360,
      "trailLengthTiles": 0.7,
      "layer": "overlay"
    },
    {
      "id": "impact",
      "trigger": "hit",
      "kind": "sprite",
      "assetId": "leaf",
      "color": "#a0dd83",
      "sizePixels": 25,
      "offset": {
        "x": 0,
        "y": 0
      },
      "delaySeconds": 0,
      "durationSeconds": 0.25,
      "count": 1,
      "speedTilesPerSecond": 1,
      "spreadDegrees": 360,
      "trailLengthTiles": 0.7,
      "layer": "overlay"
    },
    {
      "id": "debris",
      "trigger": "hit",
      "kind": "particles",
      "assetId": "leaf",
      "color": "#a0dd83",
      "sizePixels": 6,
      "offset": {
        "x": 0,
        "y": 0
      },
      "delaySeconds": 0,
      "durationSeconds": 0.5,
      "count": 12,
      "speedTilesPerSecond": 1.6,
      "spreadDegrees": 360,
      "trailLengthTiles": 0.7,
      "layer": "overlay"
    },
    {
      "id": "vine",
      "trigger": "activate",
      "kind": "trail",
      "assetId": "leaf",
      "color": "#a0dd83",
      "sizePixels": 5,
      "offset": {
        "x": 0,
        "y": 0
      },
      "delaySeconds": 0,
      "durationSeconds": 0.25,
      "count": 1,
      "speedTilesPerSecond": 1,
      "spreadDegrees": 360,
      "trailLengthTiles": 1.8,
      "layer": "overlay"
    }
  ],
  "sound": {
    "waveform": "sine",
    "frequencyHz": 440,
    "endFrequencyHz": 220,
    "durationSeconds": 0.16,
    "gain": 0.045,
    "trigger": "activation"
  }
}
