{
  "id": "sound",
  "label": "Notes et ondes sonores",
  "baseId": "normal",
  "tracks": [
    {
      "id": "prepare",
      "trigger": "prepare",
      "kind": "particles",
      "assetId": "note",
      "color": "#e2b4ee",
      "sizePixels": 9,
      "offset": {
        "x": 0,
        "y": 0
      },
      "delaySeconds": 0,
      "durationSeconds": 1.1,
      "count": 4,
      "speedTilesPerSecond": 0.4,
      "spreadDegrees": 360,
      "trailLengthTiles": 0.7,
      "layer": "overlay"
    },
    {
      "id": "release",
      "trigger": "activate",
      "kind": "particles",
      "assetId": "note",
      "color": "#e2b4ee",
      "sizePixels": 10,
      "offset": {
        "x": 0,
        "y": 0
      },
      "delaySeconds": 0,
      "durationSeconds": 0.6,
      "count": 12,
      "speedTilesPerSecond": 1.6,
      "spreadDegrees": 360,
      "trailLengthTiles": 0.7,
      "layer": "overlay"
    },
    {
      "id": "impact",
      "trigger": "hit",
      "kind": "sprite",
      "assetId": "note",
      "color": "#e2b4ee",
      "sizePixels": 25,
      "offset": {
        "x": 0,
        "y": 0
      },
      "delaySeconds": 0,
      "durationSeconds": 0.25,
      "count": 1,
      "speedTilesPerSecond": 1,
      "spreadDegrees": 360,
      "trailLengthTiles": 0.7,
      "layer": "overlay"
    },
    {
      "id": "debris",
      "trigger": "hit",
      "kind": "particles",
      "assetId": "note",
      "color": "#e2b4ee",
      "sizePixels": 6,
      "offset": {
        "x": 0,
        "y": 0
      },
      "delaySeconds": 0,
      "durationSeconds": 0.5,
      "count": 12,
      "speedTilesPerSecond": 1.6,
      "spreadDegrees": 360,
      "trailLengthTiles": 0.7,
      "layer": "overlay"
    },
    {
      "id": "notes",
      "trigger": "zone",
      "kind": "particles",
      "assetId": "note",
      "color": "#e2b4ee",
      "sizePixels": 9,
      "offset": {
        "x": 0,
        "y": 0
      },
      "delaySeconds": 0,
      "durationSeconds": 1,
      "count": 6,
      "speedTilesPerSecond": 0.5,
      "spreadDegrees": 360,
      "trailLengthTiles": 0.7,
      "layer": "overlay"
    }
  ],
  "sound": {
    "waveform": "sine",
    "frequencyHz": 660,
    "endFrequencyHz": 440,
    "durationSeconds": 0.16,
    "gain": 0.045,
    "trigger": "activation"
  }
}
